{"batch":{"id":"BATCH-AR0063-1","point_ids":["POINT-AR0063-1","POINT-AR0063-2"],"query_count":1,"relation":"independent"},"formal_spec":{"result_sha256":"3333333333333333333333333333333333333333333333333333333333333333","review_sha256":"4444444444444444444444444444444444444444444444444444444444444444","specification_sha256":"2222222222222222222222222222222222222222222222222222222222222222","status":"pass"},"kind":"batched-discussion-quality","limitations":["bounded_packet_quality_only","user_intent_not_proven","implementation_correctness_not_proven","consumer_native_gates_remain_authoritative"],"points":[{"id":"POINT-AR0063-1","proposals":[{"evaluation":{"confidence":{"applicability":0.9,"downstream":0.7,"outcome":0.8},"evidence_limits":["synthetic packet only"],"formal_refs":["specifications/discussion-batching.json"],"implications":["retain point identity"]},"id":"PROP-AR0063-1-A","rank":1,"summary":"Keep the point independent"},{"evaluation":{"confidence":{"applicability":0.6,"downstream":0.5,"outcome":0.6},"evidence_limits":["no implementation trace"],"formal_refs":["specifications/discussion-batching.json"],"implications":["requires follow-up"]},"id":"PROP-AR0063-1-B","rank":2,"summary":"Defer the decision"}]},{"id":"POINT-AR0063-2","proposals":[{"evaluation":{"confidence":{"applicability":0.8,"downstream":0.8,"outcome":0.9},"evidence_limits":["synthetic packet only"],"formal_refs":["specifications/discussion-batching.json"],"implications":["evaluate additions equally"]},"id":"PROP-AR0063-2-A","rank":1,"summary":"Evaluate each added proposal"},{"evaluation":{"confidence":{"applicability":0.5,"downstream":0.4,"outcome":0.5},"evidence_limits":["no UI evidence"],"formal_refs":["specifications/discussion-batching.json"],"implications":["retain unresolved state"]},"id":"PROP-AR0063-2-B","rank":2,"summary":"Reject additions"}]}],"privacy_projection":{"projection_sha256":"5555555555555555555555555555555555555555555555555555555555555555","public_safe":true,"redacted_fields":["prompt","response"]},"responses":[{"authorized":true,"disposition":"select","point_id":"POINT-AR0063-1","proposal_id":"PROP-AR0063-1-A","user_proposal":null},{"authorized":true,"disposition":"select","point_id":"POINT-AR0063-2","proposal_id":null,"user_proposal":{"evaluation":{"confidence":{"applicability":0.8,"downstream":0.7,"outcome":0.8},"evidence_limits":["user-authored text is not retained"],"formal_refs":["specifications/discussion-batching.json"],"implications":["apply same review threshold"]},"id":"USER-AR0063-2-A","summary":"Use a user-authored evaluated alternative"}}],"schema_version":1,"task":{"id":"AR-0063","revision":1}}
